[
  {
    "id": "Q004",
    "question_en": "Today, while providing NCD services at a home, I measured a service recipient's blood pressure and found it to be 180/110 mmHg. This is the first time in the recipient's life that their blood pressure has been measured. How should I counsel this recipient?",
    "expected_answer_en": "This may be a case of newly detected severe hypertension. Explain to the patient that while one reading isn't enough for a final diagnosis, seeing a doctor is urgent. Warn about complications of untreated hypertension (stroke, heart attack, kidney failure) and advise visiting the nearest Upazila Health Complex or hospital today or tomorrow. Do not advise any medication yourself.",
    "question_bn": "আজ একটি বাড়িতে NCD সেবা দিতে গিয়ে একজন সেবাগ্রহীতার রক্তচাপ মেপে ১৮০/১১০ mmHg পেয়েছি। সেবাগ্রহীতা জীবনে এটাই প্রথমবার রক্তচাপ মাপা হলো। এই অবস্থায় আমি সেবাগ্রহীতা কীভাবে কাউন্সেলিং করব?",
    "expected_answer_bn": "এটি নতুন শনাক্ত হওয়া গুরুতর উচ্চ রক্তচাপ হতে পারে। রোগীকে গুরুত্ব সহকারে বোঝান যে শুধু এক রিডিংয়ে চূড়ান্ত সিদ্ধান্ত নেওয়া ঠিক নয়, তাই ডাক্তার দেখানো জরুরি। untreated উচ্চ রক্তচাপের জটিলতা (স্ট্রোক, হার্ট অ্যাটাক, কিডনি বিকল) সম্পর্কে সচেতন করুন এবং আজই বা আগামীকালের মধ্যে নিকটস্থ উপজেলা স্বাস্থ্য কমপ্লেক্সে বা হাসপাতালে যেতে পরামর্শ দিন। কোনো ওষুধের পরামর্শ নিজে দেবেন না।",
    "source_card_id": [],
    "query_type": "Scenario-based",
    "linguistic_variation": "Standard Written Bengali",
    "chw_pattern": "Clinical Escalation & Patient Counseling",
    "answerable": "no",
    "confidence": "high",
    "module_id": []
  },
  {
    "id": "Q005",
    "question_en": "What general advice should I give if a service recipient's blood pressure is high?",
    "expected_answer_en": "Go to the nearest Upazila Health Complex (UHC), take medication regularly as prescribed by the doctor, control weight, walk or exercise for at least 30 minutes daily, avoid smoking and drinking alcohol, limit fatty foods and extra salt on the plate, and try to remain stress-free.",
    "question_bn": "সেবাগ্রহীতার রক্তচাপ বেশি পেলে সাধারণ পরামর্শ হিসেবে আমি কি পরামর্শ দিব?",
    "expected_answer_bn": "নিকটস্থ উপজেলা স্বাস্থ্য কমপ্লেক্সে (UHC) যান, চিকিৎসকের পরামর্শ অনুযায়ী নিয়মিত ওষুধ সেবন করুন, ওজন নিয়ন্ত্রণে রাখুন, প্রতিদিন ৩০ মিনিট হাঁটা বা ব্যায়াম করুন, ধূমপান ও মদ্যপান বর্জন করুন, চর্বি জাতীয় খাবার ও পাতের আলগা লবণ নিয়ন্ত্রণ করুন এবং দুশ্চিন্তামুক্ত থাকার চেষ্টা করুন।",
    "source_card_id": [],
    "query_type": "Procedural",
    "linguistic_variation": "Standard Written Bengali",
    "chw_pattern": "Lifestyle Counseling",
    "answerable": "no",
    "confidence": "high",
    "module_id": []
  },
  {
    "id": "Q006",
    "question_en": "What general advice should I give if a service recipient's blood glucose level is high?",
    "expected_answer_en": "Diabetes is a manageable disease, so go to the nearest health center and take medication as advised by the doctor. Limit sugar, sweets, salt, rice, white flour, and potatoes. Eat more vegetables, maintain a healthy weight, exercise regularly, quit all forms of tobacco, and avoid extra salt and fatty foods.",
    "question_bn": "সেবাগ্রহীতার রক্তে গ্লুকোজ/ শর্করার মাত্রা বেশি পেলে সাধারণ পরামর্শ হিসেবে আমি কি পরামর্শ দিব?",
    "expected_answer_bn": "ডায়াবেটিস নিয়ন্ত্রণযোগ্য রোগ, তাই নিকটস্থ স্বাস্থ্যকেন্দ্রে যান এবং চিকিৎসকের পরামর্শ অনুযায়ী ওষুধ সেবন করুন। চিনি ও মিষ্টি জাতীয় খাবার, লবণ, ভাত, সাদা আটা, আলু সীমিত করুন। শাক-সবজি বেশি খান, ওজন নিয়ন্ত্রণে রাখুন, নিয়মিত ব্যায়াম করুন, সব ধরণের তামাক বর্জন করুন এবং পাতের আলগা লবণ ও চর্বি জাতীয় খাবার এড়িয়ে চলুন।",
    "source_card_id": [],
    "query_type": "Procedural",
    "linguistic_variation": "Standard Written Bengali",
    "chw_pattern": "Chronic Disease Counseling",
    "answerable": "no",
    "confidence": "high",
    "module_id": []
  },
  {
    "id": "Q007",
    "question_en": "The service recipient has hypertension but is not interested in visiting a doctor for evaluation. As an SK, how should I convince them?",
    "expected_answer_en": "Explain to the patient that hypertension often shows no symptoms, but if left uncontrolled, it can lead to serious complications like stroke, paralysis, heart attack, or kidney failure. Do not scare them; instead, explain the necessity and benefits of regular evaluation and encourage them to go with a family member.",
    "question_bn": "সেবাগ্রহীতার উচ্চরক্তচাপ পাওয়া গেছে, কিন্তু তিনি চিকিৎসকের কাছে গিয়ে মূল্যায়ন করাতে আগ্রহী নন। SK হিসেবে আমি তাকে কীভাবে বোঝাবো?",
    "expected_answer_bn": "রোগীকে বুঝিয়ে বলুন যে উচ্চরক্তচাপ অনেক সময় কোনো লক্ষণ প্রকাশ করে না, কিন্তু দীর্ঘদিন নিয়ন্ত্রণে না থাকলে স্ট্রোক, প্যারালাইসিস, হার্ট অ্যাটাক বা কিডনি বিকল হওয়ার মতো মারাত্মক জটিলতা হতে পারে। তাকে ভীতি প্রদর্শন না করে নিয়মিত মূল্যায়নের প্রয়োজনীয়তা এবং উপকারিতা বোঝান এবং পরিবারের সদস্যকে সাথে নিয়ে যেতে উৎসাহিত করুন।",
    "source_card_id": [],
    "query_type": "Scenario-based",
    "linguistic_variation": "Standard Written Bengali",
    "chw_pattern": "Motivational Counseling & Overcoming Reluctance",
    "answerable": "no",
    "confidence": "high",
    "module_id": []
  },
  {
    "id": "Q008",
    "question_en": "The service recipient has diabetes but is not interested in visiting a doctor for evaluation. As an SK, how should I convince them?",
    "expected_answer_en": "Inform the patient that uncontrolled diabetes for a long time can damage various organs. Raise awareness about the risks of slow-healing wounds, vision loss, kidney disease, and heart attacks. Without scaring them, emphasize the importance of medical evaluation and suggest going with a family member.",
    "question_bn": "সেবাগ্রহীতার ডায়াবেটিস পাওয়া গেছে, কিন্তু তিনি চিকিৎসকের কাছে গিয়ে মূল্যায়ন করাতে আগ্রহী নন। SK হিসেবে আমি তাকে কীভাবে বোঝাবো?",
    "expected_answer_bn": "ডায়াবেটিস দীর্ঘদিন নিয়ন্ত্রণে না থাকলে শরীরের বিভিন্ন অঙ্গ ক্ষতিগ্রস্ত হতে পারে বলে জানান। ক্ষত না শুকানো, দৃষ্টিশক্তি কমে যাওয়া, কিডনি রোগ ও হার্ট অ্যাটাকের ঝুঁকি সম্পর্কে সচেতন করুন। ভীতি প্রদর্শন না করে চিকিৎসকের মূল্যায়নের গুরুত্ব এবং পরিবারের সদস্যকে সাথে নিয়ে যাওয়ার পরামর্শ দিন।",
    "source_card_id": [],
    "query_type": "Scenario-based",
    "linguistic_variation": "Standard Written Bengali",
    "chw_pattern": "Motivational Counseling & Risk Awareness",
    "answerable": "no",
    "confidence": "high",
    "module_id": []
  },
  {
    "id": "Q009",
    "question_en": "What are the symptoms of high blood pressure?",
    "expected_answer_en": "High blood pressure is primarily an asymptomatic disease. However, in some cases, symptoms like neck pain, headache, blurred vision, sweating, palpitations, and restlessness may occur.",
    "question_bn": "উচ্চরক্তচাপের লক্ষণ গুলো কি কি?",
    "expected_answer_bn": "উচ্চরক্তচাপ মূলত উপসর্গবিহীন রোগ। তবে কিছু ক্ষেত্রে ঘাড় ব্যথা, মাথা ব্যথা, চোখে ঝাপসা দেখা, ঘাম হওয়া, বুক ধড়ফড় করা এবং অস্থিরতা দেখা দিতে পারে।",
    "source_card_id": [],
    "query_type": "Factual",
    "linguistic_variation": "Standard Written Bengali",
    "chw_pattern": "Symptom Identification",
    "answerable": "no",
    "confidence": "high",
    "module_id": []
  },
  {
    "id": "Q010",
    "question_en": "What are the symptoms of diabetes?",
    "expected_answer_en": "Frequent urination, excessive thirst or dry mouth, constant hunger, rapid weight loss, and feeling weak are symptoms of diabetes.",
    "question_bn": "ডায়াবেটিসের লক্ষণ কি?",
    "expected_answer_bn": "ঘন ঘন প্রস্রাব হওয়া, অতিরিক্ত তৃষ্ণা বা মুখ শুকিয়ে যাওয়া, সবসময় ক্ষুধা লাগা, স্বল্প সময়ে ওজন কমে যাওয়া এবং শরীর দুর্বল লাগা ডায়াবেটিসের লক্ষণ।",
    "source_card_id": [],
    "query_type": "Factual",
    "linguistic_variation": "Standard Written Bengali",
    "chw_pattern": "Symptom Identification",
    "answerable": "no",
    "confidence": "high",
    "module_id": []
  },
  {
    "id": "Q011",
    "question_en": "Blood glucose level is found to be less than 3.9 mmol/L. As an SK, what should I do?",
    "expected_answer_en": "This is hypoglycemia. If the patient is conscious, give them sugary food or juice immediately. If unconscious or unable to swallow, refer immediately. If condition does not improve, refer to a doctor and advise determining the cause of hypoglycemia.",
    "question_bn": "রক্তে গ্লুকোজের পরিমাণ ৩.৯ মিলিমোল/লিটার এর থেকে কম পাওয়া গিয়েছে। SK হিসেবে আমার করণীয় কি?",
    "expected_answer_bn": "এটি হাইপোগ্লাইসেমিয়া। রোগী সচেতন থাকলে দ্রুত শর্করা জাতীয় খাবার বা জুস দিন। অচেতন বা গিলতে অক্ষম হলে সাথে সাথে রেফার করুন। অবস্থা উন্নতি না হলে দ্রুত চিকিৎসকের কাছে রেফার করুন এবং হাইপোগ্লাইসেমিয়ার কারণ নির্ণয়ের জন্য পরামর্শ দিন।",
    "source_card_id": [],
    "query_type": "Procedural",
    "linguistic_variation": "Standard Written Bengali",
    "chw_pattern": "Emergency Management & Referral",
    "answerable": "no",
    "confidence": "high",
    "module_id": []
  },
  {
    "id": "Q012",
    "question_en": "Why does hypoglycemia occur?",
    "expected_answer_en": "Hypoglycemia can occur due to excessive doses of diabetes medication, skipping meals, dieting without medical advice, excessive exercise, and severe kidney or liver problems.",
    "question_bn": "হাইপোগ্লাইসেমিয়া কেন হয়?",
    "expected_answer_bn": "ডায়াবেটিসের ওষুধের অতিরিক্ত ডোজ, সময়মতো খাবার না খাওয়া, চিকিৎসকের পরামর্শ ছাড়া ডায়েট করা, অতিরিক্ত ব্যায়াম করা এবং মারাত্মক কিডনি বা লিভারের সমস্যার কারণে হাইপোগ্লাইসেমিয়া হতে পারে।",
    "source_card_id": [],
    "query_type": "Factual",
    "linguistic_variation": "Standard Written Bengali",
    "chw_pattern": "Etiology Understanding",
    "answerable": "no",
    "confidence": "high",
    "module_id": []
  },
  {
    "id": "Q013",
    "question_en": "What are the symptoms of hypoglycemia?",
    "expected_answer_en": "Palpitations, trembling, sweating, hunger, dizziness, blurred vision, confusion, seizures, and fainting.",
    "question_bn": "হাইপোগ্লাইসেমিয়ার লক্ষণ সমুহ কি কি?",